<?xml version="1.0"?>
<GSAValveConfiguration xmlns:xsi="http://www.w3.org/2001/XMLSchema-instance" xsi:noNamespaceSchemaLocation="file:///I:/gsaValveConfiguration.xsd">

<!-- General Valve Configuration  -->
<!-- change the following sample values with those for your environment (google.com here is just a sample corporate domain) -->
<loginUrl>http://valve.google.com:8080/valve/login.jsp</loginUrl>
<authCookieDomain>.google.com</authCookieDomain>
<authenticationProcessImpl>com.google.gsa.valve.rootAuth.RootAuthenticationProcess</authenticationProcessImpl>
<authenticateServletPath>/Authenticate</authenticateServletPath>
<authorizationProcessImpl>com.google.gsa.valve.rootAuth.RootAuthorizationProcess</authorizationProcessImpl>
<authCookiePath>/</authCookiePath>
<authMaxAge>-1</authMaxAge>
<authCookieName>gsaSSOCookie</authCookieName>
<refererCookieName>gsaReferer</refererCookieName>
<searchHost>http://gsa1.google.com</searchHost>
<!-- add here more search appliance if needed. For example -->
<!-- <searchHost>http://gsa2.google.com</searchHost> -->
<maxConnectionsPerHost>60</maxConnectionsPerHost>
<maxTotalConnections>300</maxTotalConnections>
<testFormsCrawlUrl>http://valve.google.com:8080/valve/test.html</testFormsCrawlUrl>
<errorLocation>C:\\Tomcat\\webapps\\valve\\WEB-INF\\error</errorLocation>

<!-- Kerberos config. If you're not using at all just set the first two attributes to false (the rest are discarded) -->
<kerberos isKerberos="false"
          isNegotiate="false"
	  krbini="c:\\Windows\\krb5.ini"
	  krbconfig="c:\\Tomcat\\conf\\spnego\\bcsLogin.conf"
	  krbAdditionalAuthN="false"
	  krbLoginUrl="http://valve.google.com:5080/valve/loginkrb.jsp"
	  krbUsrPwdCrawler="false"
	  krbUsrPwdCrawlerUrl="http://valve.google.com:5080/valve/logincrawlerkrb.jsp"/>

<!-- Session config. If you're not using at all just set the first attribute to false (the rest are discarded) -->
<sessions isSessionEnabled="false"
	  sessionTimeout="-1"
	  maxSessionAge="360"
	  sessionCleanup="15"
	  sendCookies="true"/>

<!-- Saml config -->
<saml     isSAML="false" 
          maxArtifactAge="60"
          samlTimeout="360"/>

<!-- THE NEXT REPOSITORIES ARE JUST EXAMPLES. USE YOUR OWN REPOSITORIES CONFIGURATION -->

<!-- This is an Active Directory integration sample -->
<repository id="root" pattern="valve.google.com" authN="com.google.gsa.valve.modules.ldap.LDAPUniqueCreds" authZ="" failureAllow="true" checkAuthN="true">
	
	<P N="ldapBaseuser" V="dc=enterprise,dc=google,dc=com"/>
	<P N="ldapHost" V="ldap://ad.google.com:389"/>
	<P N="ldapDomain" V="@enterprise.google.com"/>
	<P N="rdnAttr" V="cn"/>
</repository>


<!-- This is an HTTP Basic sample -->
<repository id="HTTPBasicAuth" pattern="http://server.google.com:90" 
	authN="com.google.gsa.valve.modules.httpbasic.HTTPBasicAuthenticationProcess" authZ="com.google.gsa.valve.modules.httpbasic.HTTPBasicAuthorizationProcess" failureAllow="true" checkAuthN="true">
	<P N="HTTPAuthPage" V="http://server.google.com:90/"/>
</repository>

</GSAValveConfiguration>
